{
  "expected": {
    "mlp_loss": 0.0006340625113807619,
    "mean_pool_order_gap": 0.0,
    "causal_conv_order_gap": 5.0,
    "rnn_order_gap": 1.1350940465927124,
    "attention_order_gap": 0.5838527083396912,
    "transformer_order_gap": 1.037554383277893,
    "stump_library_gap": 0.0,
    "boosting_library_gap": 0.0,
    "token_count": 6,
    "peft_parameter_ratio": 0.15789473684210525
  },
  "absolute_tolerance": 1e-6,
  "provenance": "Deterministic CPU PyTorch training, explicit sequence permutation, classical-library cross-checks and frozen text adaptation are recomputed from the synthetic fixture.",
  "fixture": {"path":"data/fixtures/ml-alpha-model.json","sha256":"c4dbcb2a2fffce9e8356d08f749a17c34bc23c5b299cd7da997a29fd15e2ed6a"}
}
