{
  "expected": {
    "slope": 1.991231237902948,
    "adf_statistic": -8.31346677615835,
    "johansen_rank": 1,
    "ecm_speed": -0.46056154698491136,
    "half_life": 1.1393307423034074,
    "nonstationary_ou_rejected": 1
  },
  "absolute_tolerance": 1e-10,
  "provenance": "The level relation, residual recursion, ECM adjustment and OU mapping are independently calculable from the deterministic synthetic path.",
  "fixture": {"path":"data/fixtures/stat-arb-model.json","sha256":"6a363d56f7b5af2b3505cefc7afaf79eeec003cae5cd4381ee13b9eaeeebfe13"}
}
