{
  "expected": {
    "rows": 40,
    "growth_rows": 39,
    "covariance_trace": 0.00007415213340406507,
    "risk_parity_weight_1": 0.4341837363053994,
    "risk_parity_weight_2": 0.5658162636946005,
    "cvar_confidence": 0.75,
    "cvar_weight_1": 0.19999999999999996,
    "cvar_weight_2": 0.8,
    "cvar_objective": 0.001212363855037633,
    "tail_confidence": 0.75,
    "tail_effective_observations": 9.75,
    "tail_value_at_risk": -0.003206207556289087,
    "tail_expected_shortfall": 0.0023175421280141376,
    "tail_status": "warn"
  },
  "absolute_tolerance": 1e-12,
  "provenance": "The frozen public-domain macro levels are converted to adjacent log growth before covariance and equal-risk calculations. The columns are not claimed to be tradable assets.",
  "fixture": {
    "path": "data/real/stat-arb-us-macro-1999q4-2009q3.json",
    "sha256": "fe70a0e73aab9a4989fb4c9e2c230e6aedc686a5ca8f8cdf071ecb032adb93a1"
  }
}
