{
  "expected": {
    "predictive_mean": 0.025,
    "classic_risk_price": 0.006,
    "scaled_second_slope": 0.015
  },
  "absolute_tolerance": 1e-12,
  "provenance": "The predictive slopes, factor-return mean, and rescaling result are independently calculable from the exact linear synthetic panel.",
  "published_markers": [
    "预测型 Fama--MacBeth 的两期斜率为 $0.020$ 与 $0.030$，均值为 $0.025$。",
    "经典两遍法的因子风险价格为因子收益均值 $0.006$。"
  ],
  "fixture": {
    "path": "data/fixtures/multifactor-model.json",
    "sha256": "7fde2b7a51b8292d0a1e803dc45690802b0ace58bab278186df9263a7f2d6b81"
  }
}
